{
  "$schema": "https://json-schema.org/draft/2020-12/schema",
  "$id": "https://local-llm-vram-atlas.local/schemas/evaluation-result.schema.json",
  "title": "AtlasEvaluationResult",
  "description": "One Atlas-normalized benchmark evaluation for an exact model/revision identity. Raw source score is always preserved; base-model scores never stand in for quantized variants; different benchmark versions are never merged. Specification version 0.6.0 (Phase 6, pre-1.0).",
  "type": "object",
  "additionalProperties": false,
  "required": [
    "schema_version",
    "evaluation_id",
    "model_id",
    "benchmark_id",
    "benchmark_name",
    "metric",
    "metric_direction",
    "score",
    "score_unit",
    "evaluation_origin",
    "verification_status",
    "source_id",
    "source_observed_at",
    "evidence_ids",
    "match_status"
  ],
  "properties": {
    "schema_version": {
      "type": "string",
      "pattern": "^0\\.[0-9]+\\.[0-9]+$"
    },
    "evaluation_id": {
      "type": "string",
      "pattern": "^[a-z0-9][a-z0-9-]{1,120}$",
      "description": "Bounded deterministic digest ID (evl-v1-<sha256>)."
    },
    "model_id": {
      "type": "string",
      "minLength": 1,
      "description": "Canonical Atlas model_id this evaluation is attached to."
    },
    "model_revision": {
      "type": ["string", "null"],
      "description": "Exact evaluated revision when the source states it; null means unresolved."
    },
    "artifact_id": {
      "type": ["string", "null"],
      "description": "Exact artifact variant evaluated, when the evaluation names one."
    },
    "quantization": {
      "type": ["string", "null"],
      "description": "Exact quant label tested; a base-model score never stands in for a quantized variant."
    },
    "benchmark_id": {
      "type": "string",
      "minLength": 1,
      "description": "Stable benchmark identity slug (name + version family, not the raw score)."
    },
    "benchmark_name": { "type": "string", "minLength": 1 },
    "benchmark_version": {
      "type": ["string", "null"],
      "description": "Benchmark/harness version; null means unstated. Different versions are never compared as equals."
    },
    "suite_version": {
      "type": ["string", "null"],
      "description": "Evaluation suite version (e.g. Intelligence Index v4.3.2) when applicable."
    },
    "task": { "type": ["string", "null"] },
    "metric": { "type": "string", "minLength": 1 },
    "metric_direction": {
      "type": "string",
      "enum": ["higher_is_better", "lower_is_better"],
      "description": "Direction is explicit; never assume higher is better."
    },
    "score": { "type": "number" },
    "score_unit": {
      "type": "string",
      "minLength": 1,
      "description": "Unit is part of the result; unitless cross-benchmark comparison is forbidden."
    },
    "reasoning_mode": {
      "type": ["string", "null"],
      "description": "e.g. thinking / non-thinking / max-reasoning; never compared across modes without disclosure."
    },
    "tool_mode": { "type": ["string", "null"] },
    "prompting_mode": { "type": ["string", "null"] },
    "context_configuration": { "type": ["string", "null"] },
    "evaluation_origin": {
      "type": "string",
      "enum": ["publisher", "independent", "community"],
      "description": "Publisher results are never relabeled independent; two republishers are not two evaluations."
    },
    "verification_status": {
      "type": "string",
      "enum": ["unknown", "unverified", "estimated", "publisher_claim", "quantizer_claim", "independently_verified", "atlas_verified"]
    },
    "evaluator": { "type": ["string", "null"] },
    "evaluation_date": {
      "type": ["string", "null"],
      "format": "date",
      "description": "Source evaluation date; null means unstated (unknown, never invented)."
    },
    "source_id": { "type": "string", "minLength": 1 },
    "source_url": {
      "type": ["string", "null"],
      "format": "uri",
      "pattern": "^https?://\\S+$"
    },
    "source_observed_at": { "type": "string", "format": "date-time" },
    "evidence_ids": {
      "type": "array",
      "items": { "type": "string", "minLength": 1 },
      "minItems": 1,
      "uniqueItems": true
    },
    "match_status": {
      "type": "string",
      "enum": ["exact", "exact_repo_revision_unresolved", "ambiguous", "identity_conflict"],
      "description": "Ambiguous or conflicting identities are excluded from strict ranking."
    },
    "superseded": { "type": "boolean", "default": false },
    "superseded_by": { "type": ["string", "null"] },
    "notes": { "type": ["string", "null"], "maxLength": 2000 }
  }
}
