{
  "artifact_id": null,
  "benchmark_id": "ifeval",
  "benchmark_name": "IFEval (Average prompt/inst)",
  "benchmark_version": null,
  "context_configuration": null,
  "evaluation_date": null,
  "evaluation_id": "evl-v1-5ed1a1b7c1c5dcfd0436875c7371b406c185a839526e08272a995f63d5b2b44e",
  "evaluation_origin": "publisher",
  "evaluator": "HuggingFaceTB",
  "evidence_ids": [
    "ev-v2-57d9488b5fbcb3438a2f61d1dd2b7b78814a503393db46a617e6256bb10f9b94"
  ],
  "match_status": "exact_repo_revision_unresolved",
  "metric": "IFEval average prompt/instruction strict accuracy",
  "metric_direction": "higher_is_better",
  "model_id": "huggingfacetb-smollm2-1-7b-instruct",
  "model_revision": null,
  "notes": "Publisher states lighteval harness; shot count is part of comparability.",
  "prompting_mode": "lighteval, zero-shot unless stated",
  "quantization": null,
  "reasoning_mode": "non-reasoning",
  "schema_version": "0.6.0",
  "score": 56.7,
  "score_unit": "percent",
  "source_id": "smollm2-model-card",
  "source_observed_at": "2026-10-05T00:00:00Z",
  "source_url": "https://huggingface.co/HuggingFaceTB/SmolLM2-1.7B-Instruct",
  "suite_version": null,
  "superseded": false,
  "superseded_by": null,
  "task": "instruction_following",
  "tool_mode": null,
  "verification_status": "publisher_claim"
}
