{
  "artifact_id": null,
  "benchmark_id": "gsm8k",
  "benchmark_name": "GSM8K (5-shot)",
  "benchmark_version": "5-shot",
  "context_configuration": null,
  "evaluation_date": null,
  "evaluation_id": "evl-v1-d21f7b1ab4e991f350c0e980c12e20594d197f40d8dbfa134cb0cdd11a777aea",
  "evaluation_origin": "publisher",
  "evaluator": "HuggingFaceTB",
  "evidence_ids": [
    "ev-v2-57d9488b5fbcb3438a2f61d1dd2b7b78814a503393db46a617e6256bb10f9b94"
  ],
  "match_status": "exact_repo_revision_unresolved",
  "metric": "GSM8K 5-shot accuracy",
  "metric_direction": "higher_is_better",
  "model_id": "huggingfacetb-smollm2-1-7b-instruct",
  "model_revision": null,
  "notes": "Publisher states lighteval harness; shot count is part of comparability.",
  "prompting_mode": "lighteval, zero-shot unless stated",
  "quantization": null,
  "reasoning_mode": "non-reasoning",
  "schema_version": "0.6.0",
  "score": 48.2,
  "score_unit": "percent",
  "source_id": "smollm2-model-card",
  "source_observed_at": "2026-10-05T00:00:00Z",
  "source_url": "https://huggingface.co/HuggingFaceTB/SmolLM2-1.7B-Instruct",
  "suite_version": null,
  "superseded": false,
  "superseded_by": null,
  "task": "grade_school_math",
  "tool_mode": null,
  "verification_status": "publisher_claim"
}
