{
  "artifact_id": null,
  "benchmark_id": "gpqa-diamond",
  "benchmark_name": "GPQA Diamond",
  "benchmark_version": null,
  "context_configuration": "max generation length 32768 tokens",
  "evaluation_date": null,
  "evaluation_id": "evl-v1-3c8bd6b67a42deb973717674941614e519ed27115d70a38c4bd658c03cf38fdd",
  "evaluation_origin": "publisher",
  "evaluator": "DeepSeek-AI",
  "evidence_ids": [
    "ev-v2-f2c5d0475df8fb260861af8cbf1fa0f403e2dd1b028eb6b9cb70e0a854c236be"
  ],
  "match_status": "exact_repo_revision_unresolved",
  "metric": "GPQA Diamond pass@1",
  "metric_direction": "higher_is_better",
  "model_id": "deepseek-ai-deepseek-r1-distill-qwen-7b",
  "model_revision": null,
  "notes": "Publisher states temperature 0.6, top-p 0.95 and 64 samples per query for pass@1 estimation.",
  "prompting_mode": "no system prompt (publisher recommendation)",
  "quantization": null,
  "reasoning_mode": "reasoning",
  "schema_version": "0.6.0",
  "score": 49.1,
  "score_unit": "percent",
  "source_id": "deepseek-r1-repo-report",
  "source_observed_at": "2026-10-05T00:00:00Z",
  "source_url": "https://github.com/deepseek-ai/DeepSeek-R1",
  "suite_version": null,
  "superseded": false,
  "superseded_by": null,
  "task": "graduate_science_qa",
  "tool_mode": null,
  "verification_status": "publisher_claim"
}
