{
  "artifact_id": null,
  "benchmark_id": "aime-2024",
  "benchmark_name": "AIME 2024",
  "benchmark_version": "2024",
  "context_configuration": "max generation length 32768 tokens",
  "evaluation_date": null,
  "evaluation_id": "evl-v1-2b61b13233fed885cf036abfe1a6ccc67fad319952ee3aea93300ee32f77d5fd",
  "evaluation_origin": "publisher",
  "evaluator": "DeepSeek-AI",
  "evidence_ids": [
    "ev-v2-f2c5d0475df8fb260861af8cbf1fa0f403e2dd1b028eb6b9cb70e0a854c236be"
  ],
  "match_status": "exact_repo_revision_unresolved",
  "metric": "AIME 2024 pass@1",
  "metric_direction": "higher_is_better",
  "model_id": "deepseek-ai-deepseek-r1-distill-qwen-7b",
  "model_revision": null,
  "notes": "Publisher states temperature 0.6, top-p 0.95 and 64 samples per query for pass@1 estimation.",
  "prompting_mode": "no system prompt (publisher recommendation)",
  "quantization": null,
  "reasoning_mode": "reasoning",
  "schema_version": "0.6.0",
  "score": 55.5,
  "score_unit": "percent",
  "source_id": "deepseek-r1-repo-report",
  "source_observed_at": "2026-10-05T00:00:00Z",
  "source_url": "https://github.com/deepseek-ai/DeepSeek-R1",
  "suite_version": null,
  "superseded": false,
  "superseded_by": null,
  "task": "competition_math",
  "tool_mode": null,
  "verification_status": "publisher_claim"
}
