{
  "artifact_id": null,
  "benchmark_id": "math",
  "benchmark_name": "MATH",
  "benchmark_version": null,
  "context_configuration": null,
  "evaluation_date": null,
  "evaluation_id": "evl-v1-1e04a3f3c067403a69d83ea27c8fb5897bc7866edbb123c9f7aaa1bb71017e3a",
  "evaluation_origin": "publisher",
  "evaluator": "Microsoft Research",
  "evidence_ids": [
    "ev-v2-0df0fd3068bf364ca5e265c94ee4883279935e51f01d447f15cdef58d20e8854"
  ],
  "match_status": "exact_repo_revision_unresolved",
  "metric": "MATH accuracy",
  "metric_direction": "higher_is_better",
  "model_id": "microsoft-phi-4",
  "model_revision": null,
  "notes": "Publisher notes some simple-evals scores differ from third-party figures because of formatting requirements; recorded as an explicit source-conflict signal.",
  "prompting_mode": "simple-evals",
  "quantization": null,
  "reasoning_mode": "non-reasoning",
  "schema_version": "0.6.0",
  "score": 80.4,
  "score_unit": "percent",
  "source_id": "phi4-model-card",
  "source_observed_at": "2026-10-05T00:00:00Z",
  "source_url": "https://huggingface.co/microsoft/phi-4",
  "suite_version": null,
  "superseded": false,
  "superseded_by": null,
  "task": "competition_math",
  "tool_mode": null,
  "verification_status": "publisher_claim"
}
