{
  "artifact_id": "prism-ml-ternary-bonsai-2-27b-gguf--gguf--ternary-bonsai-2-27b-p.gguf--tq1_0",
  "benchmark_id": "prism-ml-14b-thinking-average",
  "benchmark_name": "Prism ML 14-benchmark thinking-mode suite",
  "benchmark_version": "card-as-observed-2026-10-05",
  "context_configuration": "prism-ml-card-14b-thinking-mode; EvalScope+vLLM; NVIDIA H100; identical infrastructure, decoding and scoring; card min_p=0.0",
  "evaluation_date": null,
  "evaluation_id": "evl-v1-cffa7600062b83ae66e217b9dcbcfc8ff4ad7b31ef62204ff4e64b7d58f5ec33",
  "evaluation_origin": "publisher",
  "evaluator": "Prism ML (EvalScope + vLLM, NVIDIA H100)",
  "evidence_ids": [
    "ev-v2-b078d5eb5812df5a84438624fa1cb28e7d644227ff6170a78d94ad7639db1fab"
  ],
  "match_status": "exact",
  "metric": "thinking_mode_average_14_benchmarks",
  "metric_direction": "higher_is_better",
  "model_id": "prism-ml-ternary-bonsai-2-27b-gguf",
  "model_revision": "b072e1d3b35a0a630cece372c2127528e0994386",
  "notes": "Publisher-reported aggregate. The card's 'Bonsai 2 27B' row is the 5.95 GB ternary g128 PTQ1_0 packing, which is the artifact of Core candidate core-8g-05; the 7.21 GB PQ2_0 packing is reported separately by the same publisher. Both sides of this comparison come from one publisher run, so it is Q4 publisher evidence.",
  "prompting_mode": "publisher_declared_identical_decoding",
  "quantization": null,
  "reasoning_mode": "thinking",
  "schema_version": "0.6.0",
  "score": 84.78,
  "score_unit": "percent",
  "source_id": "prism-ml-bonsai-card",
  "source_observed_at": "2026-10-05T00:00:00Z",
  "source_url": "https://huggingface.co/prism-ml/Ternary-Bonsai-2-27B-gguf",
  "suite_version": "EvalScope+vLLM-h100",
  "superseded": false,
  "superseded_by": null,
  "task": "multi_domain_reasoning_coding_instruction_agentic_vision",
  "tool_mode": "tool_calling_in_suite_bfcl_v3",
  "verification_status": "publisher_claim"
}
