{
  "artifact_id": null,
  "benchmark_id": "drop",
  "benchmark_name": "DROP",
  "benchmark_version": null,
  "context_configuration": null,
  "evaluation_date": null,
  "evaluation_id": "evl-v1-270f663947b2260bf2fc9ed23371c49d6b856cb8e2287331c7e20993cae0db85",
  "evaluation_origin": "publisher",
  "evaluator": "Microsoft Research",
  "evidence_ids": [
    "ev-v2-0df0fd3068bf364ca5e265c94ee4883279935e51f01d447f15cdef58d20e8854"
  ],
  "match_status": "exact_repo_revision_unresolved",
  "metric": "DROP F1",
  "metric_direction": "higher_is_better",
  "model_id": "microsoft-phi-4",
  "model_revision": null,
  "notes": "Publisher notes some simple-evals scores differ from third-party figures because of formatting requirements; recorded as an explicit source-conflict signal.",
  "prompting_mode": "simple-evals",
  "quantization": null,
  "reasoning_mode": "non-reasoning",
  "schema_version": "0.6.0",
  "score": 75.5,
  "score_unit": "f1_points",
  "source_id": "phi4-model-card",
  "source_observed_at": "2026-10-05T00:00:00Z",
  "source_url": "https://huggingface.co/microsoft/phi-4",
  "suite_version": null,
  "superseded": false,
  "superseded_by": null,
  "task": "reading_comprehension",
  "tool_mode": null,
  "verification_status": "publisher_claim"
}
